{"assets":[],"cellSize":[32,32],"format":"maplab.tileset","id":"tileset.forest","name":"Forest placeholder tiles","rules":[{"id":"rule.fill","neighborMask":255,"outputTileIds":["tile.dirt"],"priority":5,"terrainId":"terrain.forest","weights":[1]},{"id":"rule.top","neighborMask":124,"outputTileIds":["tile.grass"],"priority":10,"terrainId":"terrain.forest","weights":[1]}],"rulesVersion":1,"terrains":[{"biome":"forest","fallbackTileId":"tile.dirt","id":"terrain.forest","name":"Forest ground"}],"tiles":[{"allowMirrorX":true,"allowMirrorY":true,"allowedQuarterTurns":[0,1,2,3],"id":"tile.dirt","suggestedMaterialId":"material.earth","terrainId":"terrain.forest","traceShapes":[{"id":"trace.full","kind":"rect","rect":[0,0,32,32]}],"visual":{"fill":"#6b4f2f","kind":"shape","shape":{"kind":"rect","rect":[0,0,32,32]}}},{"allowMirrorX":true,"allowMirrorY":false,"allowedQuarterTurns":[0],"id":"tile.grass","suggestedMaterialId":"material.earth","terrainId":"terrain.forest","traceShapes":[{"id":"trace.full","kind":"rect","rect":[0,0,32,32]}],"visual":{"fill":"#4f7a36","kind":"shape","shape":{"kind":"rect","rect":[0,0,32,32]}}},{"allowMirrorX":true,"allowMirrorY":false,"allowedQuarterTurns":[0],"id":"tile.slope.up","suggestedMaterialId":"material.earth","terrainId":"terrain.forest","traceShapes":[{"id":"trace.slope","kind":"polygon","points":[[0,32],[32,16],[32,32]]}],"visual":{"fill":"#4f7a36","kind":"shape","shape":{"kind":"polygon","points":[[0,32],[32,16],[32,32]]}}}],"version":1}